{
  "version": "0.1",
  "updated_at": "2026-02-22T12:00:00Z",
  "entity": {
    "name": "LittleExplorer",
    "canonical_url": "https://littleexplorer.com"
  },
  "language": "en",
  "topics": ["kids", "children-clothing", "toys", "baby-gear", "family"],
  "endpoints": {
    "products": "https://littleexplorer.com/llm/products",
    "policies": "https://littleexplorer.com/llm/policies",
    "faq": "https://littleexplorer.com/llm/faq",
    "about": "https://littleexplorer.com/llm/about"
  },
  "feeds": {
    "products_jsonl": "https://littleexplorer.com/llm/feed/products.jsonl"
  },
  "license": "CC-BY-NC-4.0",
  "verify": {
    "method": "dns_txt",
    "value": "llmindex-verify-littleexplorer-2026"
  }
}
