{
  "version": "0.1",
  "updated_at": "2026-02-22T12:00:00Z",
  "entity": {
    "name": "PawHaven",
    "canonical_url": "https://pawhaven.com"
  },
  "language": "en",
  "topics": ["pets", "dog-food", "cat-supplies", "pet-health", "subscription"],
  "endpoints": {
    "products": "https://pawhaven.com/llm/products",
    "policies": "https://pawhaven.com/llm/policies",
    "faq": "https://pawhaven.com/llm/faq",
    "about": "https://pawhaven.com/llm/about"
  },
  "feeds": {
    "products_jsonl": "https://pawhaven.com/llm/feed/products.jsonl"
  },
  "license": "CC-BY-4.0",
  "verify": {
    "method": "dns_txt",
    "value": "llmindex-verify-pawhaven-2026"
  }
}
